1,Username,Date,Time,Comment,Reply,Reply-To,Reply-To_Row_Num,Respect_Count,Edited
2,ThePessimist,6/27/19,13:48,"""it would cost $167 million above what the City Council has budgeted for libraries.""

So there you have the problem. City Council should learn how to prioritize and budget properly. Vote ""No"" and send a message for city council to fund core city services and put non-essential programs on the ballot.

""you’re not going to choose paying fines over eating,”

That's the wrong comparison to make. Low income people can choose to return books on time over paying fines.

""Seattle voters are a generous lot""

I think the STEB is conflating generosity with gullability here.",no,na,na,4,yes
3,hewhois,6/27/19,8:27 AM,"Again the “renewal” trick. This is not a renewal, it is a brand new levy almost doubling the expiring levy. I’m voting no for that reason, and the stupid, irresponsible cancelling of late fees. To suggest that low income people are less able to return a book on time than higher income people is classist and insulting. Responsibility is not income dependent.",no,na,na,4,no
4,Scrumdog1,6/27/19,6:49 AM,"It is not a library system, it is a homeless day care facility with web access for adult videos.",no,na,na,6,no
5,citizen cane,6/26/19,11:50 PM,This is not an editorial it is propaganda ,no,na,na,6,no
6,rjr4rjr4,6/26/19,7:39 PM,Libraries lost their relevance at the end of the 20th century and are now just homeless shelters in disguise.,no,na,na,8,no
7,DAWG9691,6/26/19,4:08 PM,"  Nice to see the times not allowing comments against their opinion.

The Library’s major increase in expense has been providing WiFi to the homeless. Everything seems to be a sleight of hand by the government and the ST editorial board supports 95% of it.",no,na,na,9,no
8,amember,6/26/19,2:49 PM,"""you’re not going to choose paying fines over eating""

Hence, it is reasonable to expect they will also not enforce collection of taxes, since

""you're not going to choose paying taxes over eating""",no,na,na,4,no
9,walter mitty,6/26/19,2:26 PM,"Unless something compelling causes me to change my mind, I plan on voting NO. Government sponsored programs and services are created, in theory, to support the needs of the residents within their community. If the service needs grow, the support base can chip in to fund the services which have proven to be a need.  

I reviewed annual reports from the library website (2007 to 2016) and what stuck out in my mind was this:

Library materials checked out by children increased slightly, while people attending library programs saw a surge. There were new metrics as a result of technology such as increase in online streamed materials, as an example.

Noteworthy, however, was the decline in adult materials checked out (DOWN 26%), media use – DVD, audiobooks, CDs (DOWN 42%), library visitors (DOWN 24%), customers contacting the library with reference questions (DOWN 32%).

Personnel costs increased 8% with a corresponding increase in payroll, up 38%. ($39m in 2009 to $52.8m in 2016).

Infusions of money saw $196m in 1998 (levy), $123m in 2012 (bond). Now, the library is asking for an additional $218.1m. Let’s just round that off to half a billion dollars in 20 years…over and above the City's general funding.

The proposed levy seeks to leverage property owners into subsidizing library services, some of which (my opinion) do not rise to the level of NEED, nor do they match the services requested by their consumer base. They seem to fall more under “boy it sure would be neat if we” like options on a car….so the push is on now to try and convince Seattle residents that they really need these improvements. Kind of a 'we know what's good for you' instead of ""you've asked for these improvement again and again.""

During this same period of time, my property tax on my small footprint home has increased $2000/yr. This nickel and diming of claims against my property is hidden behind glowing, altruistic sound bites with labels which pander to voters’ emotions. This is where I take a stand against unabated spending by government agencies.

Why not operate the library within their budget and means?  Structure the services without all the pie in the sky, unicorn and rainbow options? Quit looking to property owners as your cash cow…. which is quite different than asking each voter... which includes those who do not have a direct nexus to property tax responsibility, to step up and chipping in?

There are way too many other City services which I feel have a higher priority which I’m more likely to dig a little deeper and make a sacrifice given my limited income status.

Libraries have evolved over the past 20 years due to technology.  More homes and people have access to information and learning services which bypass the traditional library.  Libraries have found it challenging to remain relevant in their communities than ever before.  The details of the proposed levy just aren't compelling enough for me.  I'm voting NO.",no,na,na,17,no
10,springthaw,6/27/19,2:48 AM,"Thank you for your research and the number crunching. Those numbers reflect what many library systems all over the US are facing, less usage. It’s why SPL is venturing into offering classes and social services in trying to stay relevant and up the usage number. 

Many of the SPL programs such as ESL class , citizenship class, homework help, basic computer literacy class are duplicating what many Seattle nonprofits already offered to the public.  Goodwill, Literacy Source, Seattle Community Colleges, El Centro de la Reza, Catholic charities, Seattle Public Schools, and the many local nonprofits that work with immigrants and the poor have similar programs in place.  In addition, many of the people who need such help don’t live in Seattle because it’s unaffordable.  It’s why the need for such programs are in places like Tukwila, SeaTac, and Burien. 

I can see a library Levy for capital improvement. 

I will vote NO because this Levy is too expensive and the library shouldn’t be wasting tax dollars trying to offer services already well covered by many non-profits (which do a better job) or other city departments.

I also have mixed feelings about getting rid of late fines. The library shouldn’t impose fines on children's books and materials, but adults are fair game.  Get rid of the fine and people will hang onto these book longer than necessary and keep them out of circulation- which goes against the purpose of a circulating library. ",yes,walter mitty,9,4,no
11,Iibqa,6/26/19,2:02 PM,"I am firmly against this levy because of the proposed policy to eliminate fines for overdue and unreturned/lost materials. This is an invitation for more irresponsible behavior. If the primary purpose of public libraries is for everyone to share in its resources, then how can we share when some people aren't taking seriously the requirement to return checked-out items in a timely way. It should be a privilege, and not just a right, to have a library card. If someone cannot bide by the rules of the library return policy, and refuses to pay the small fines, their privileges ought to be taken away. They can still use library resources, but should not be permitted to remove them from the library.

If this levy passes, and fines are eliminated, will eliminating the need for library cards be next? What is there to keep someone from starting their own home library with unreturned books? ",no,na,na,13,no
12,user744108,6/26/19,10:38 AM,"This seems like another example of basic government services being held hostage in order to ensure voter approval.  Either you double the past levy (almost) and fund our pet social-justice programs (no fines), or we will ""be forced"" to drastically cut library services.  No inbetween. 

Also, what percentage of the library budget came from general fund dollars before the great recession and what is the percentage now?  Are there programs or costs (payroll or operational) that are currently coming out of the general fund that will switch to levy dollars if this passes?  If so, then the levy is just part of an accounting trick to increase your taxes to pay for other pet projects, using money from the general fund that used to go to the library (displacement). These are the questions that need answering so voters know whether this is truly a library levy or really just a social justice program levy disguised as a library levy, in whole or in part.",no,na,na,14,no
13,ThePessimist,6/27/19,1:58 PM,"You hit the nail on the head. Displacement is the game. They do it with parks, libraries, public safety, transportation, you name it. The parks district was a massive displacement trick. It begs the question why the city doesn't put less important programs on the ballot but the answer is obvious- they know the public would vote down their pet projects. Seattle voters are not generous; they are gullible. They fall for these tricks time and time again. Worse yet, common citizens go out and actively promote these displacement ballot measures on social media and in other ways. It's bad enough to be tricked into voting for financial displacement, but to get lured into going out and spreading the propaganda is another level of gullibility.",yes,user744108,12,1,no
14,eumnwa,6/26/19,10:16 AM,"As Library Board President Jay Reich sees it, “If you want to collect more than a 1% increase in property taxes per year, you have to vote it. And our expenses are going up faster than 1% — by a lot.”
This is a lie.  Has anyone seen 1% or less property tax growth? No, because assessed values have gone up far more than 1% per year.
Also, when the library stops supporting left wing political commentary/events and allows homeless parking or open viewing of graphic adult content, then maybe...",no,na,na,5,no
15,Eastward,6/26/19,5:28 PM,"Ah, the last paragraph gives you away.  You just don't want people to have information.  Particularly if it does not comport with your white bread view of the world.  Also not buying your concerns about ""parking"" or content viewing:  Can you imagine any library trying to restrict what people read and watch?  I guess YOU could.  This is America, not China.

Also, you are totally ignorant on public funding.  Employee salaries are rising as are benefits and medical insurance coverages.  They are in the 3-6% annual range.  Property tax receipts for a municipality can ONLY increase by 1% per year under state law, plus any smaller increase in ""new construction.""

Seattle, Medina, Kitsap County libraries are all in the same position.  There is no waste, simply a restrictive state law that squeezes municip0alities more than even cost of living increases.",yes,eumnwa,14,0,no
16,Cameric98133,6/26/19,8:56 AM,"Our libraries are one of the civic jewels that makes Seattle a great place to live, similar to parks, our various waterfronts and museums. I see that some of the cranks are already sniping that the levy isn't ""worth it."" 

For those who don't read much or visit libraries regularly, paying that much isn't worth it. They might be thinking, ""I want to keep my $7 a month. I don't want to donate it so others can read a book."" 

But the libraries aren't measured by worth; they are measured by value.

There is value in being able to check out (for free) $300 worth of books on landscaping when you are putting in irrigation in your back yard. Instead of buying the books at Home Depot. There is value in having a young student in a limited-income household be able to get information for a school paper, instead of trying to buy it from a bookstore. Having all that knowledge available is a public value, a public good. Like paved streets, mass transit and concert halls, it is infrastructure that is not meant to make a profit, but to make our lives better. ",no,na,na,4,yes
17,IIbqa,6/26/19,9:39 AM,"I agree with the value of our libraries, but am opposed to the policy of eliminating fines for late or unreturned books and other checked-out items. This gives the impression that it is OK to be irresponsible. We need these items to be returned in a timely way so that other people have access to be able to borrow them, too.  That is the purpose of having a public library. Although I am a Friend of the Library and donate to it every year, I will be voting against this levy for this reason.",yes,Cameric98133,16,14,no
18,akcrabber,6/26/19,10:52 AM,Cutting off your nose to spite your face. Fines don't work. I really doubt you vote for any property tax measures.,yes,Iibqa,17,0,no
19,IIbqa,6/26/19,11:27 AM,"I am a smart voter. I read both sides, ask questions, and make informed decisions. I don't blindly allow ST to make my decisions for me, but do read their editorials. I don't vote for things I am absolutely opposed to, and will likely continue to donate to Seattle Public Library because I do believe in their main purpose--to provide books and other items that we all can share. Using a library card to check out items should be considered a privilege. To continually be negligent in returning checked-out items within a reasonable amount of time is abusing that privilege, and that privilege should be discontinued or they pay the fines. Those people can still continue to use the resourses of the library, but they should not be allowed take them from the library.",yes,akcrabber,18,12,no
20,ThePessimist,6/27/19,2:01 PM,"Making it personal isn't likely to change any minds, and you certainly didn't change mine. I'm still voting ""No"".",yes,akcrabber,18,1,no
21,ThePessimist,6/27/19,2:00 PM,"Did it ever occur to you that if libraries are really really valuable, then city council should fully fund them without putting them on a ballot measure? Seriously, have you ever considered that? Why put such a valuable civic jewel on a ballot measure? Fully fund it and put non-civic jewels on the ballot.",yes,IIbqa,17,1,no
22,MMBU,6/26/19,8:25 AM,"""Fines may seem insignificant to some, but for those on a limited or fixed income, who might lose a book or forget to return it on time...""

Most of us on are on ""limited"" incomes, in so much as we only make what we make, and behing salaried exempt means it's fixed as well. But it's true that to me, as modest as my income is, a couple of bucks worth of fines aren't a big deal, but I'm just as likely to lose or forget to return a book as someone on a ""limited or fixed income"". I have a full-time job, a full-time project house/garden, and two active dogs. I don't have kids or a hugely active social life, for which I am grateful since I already feel like there aren't enough hours in the day. I get up insanely early in the morning, and am still running to catch a bus to work, as well as home in the afternoon. And I rarely get to bed ""on time"", so I always feel like I'm behind on sleep. What makes you think I'm less likely to forget a book on a bus, or forget to throw it in my bag when it's time to return it?

I'll tell you what would make you think it. It's a word... Starts with an ""R"", ends in ""ility"". C'mon, I know you know it!

Although, I will admit to having had overdue book fines a couple of times in my life.  It's been a long time and they were modest ones, like a day late or so. I paid them. And once I lost a book, but I replaced it.

The choice is not between paying fines and eating. The choice is between being a responsible library patron and member of community (which does not have a minimum income requirement)! and returning the book on time, or being a self-absorbed individual who has no consideration for other patrons (who also might very well be on a limited or fixed income) who are waiting to borrow the book that you took and can't be bothered to bring back.

Or, if you just want to make it all about you...it's about bringing the book back on time and being able to continue to use the library, or not. If you're one of the 19% of users who are one of ""those who may need the library the most"", then wouldn't you be really motivated not to be late? You're able to get to the library to use it when you ""need"" it, but not able to get there to return a book?

The rules don't apply to you because of the amount of money you make (or don't)? Really?
I support more money for libraries. I don't support ending fines, or the mentality behind it. And I especially don't support enabling others in their abdication of all responsibiity in life. Because you know it doesn't end with not getting library books back on time.",no,na,na,20,yes
23,akcrabber,6/26/19,10:55 AM,Everybody needs somebody to look down on. Hope you're wearing a helmet when you fall off that high horse.,yes,MMBU,22,1,no
24,MMBU,6/27/19,9:21 AM,"I didn't say I looked down on people, or that lower-income people are somehow less than I am. I said I don't support the mentality that is proposing to eliminate fines. That is true whether it be a person who thinks they are doing this to help the less fortunate, or if it someone who is less fortunate who believes they shouldn't have to live by the same rules.

I really do have a problem with this idea that somehow, asking lower-income people to follow the rules of using a public service is akin to asking them to starve themselves. They aren't being asked to starve themselves...they are being asked to follow the rules like everyone else. Why is that unreasonable?

Substitue library fines with something else. More serious, perhaps. For example, let's say you get hit by a drunk driver. Does it actually matter how much money the perpetrator makes? Is it less egregious that they decided to get behind the wheel iif they make $35K a year, as opposed to someone who makes $70K? Or if they run a red light and endanger pedestrians? Neglect their children? Or even just dump their old mattress in your neighborhood? At what point do you say...""Because you don't make as much money as other people, I'm okay with you doing this""? 

And yes, a late library book is many, many times less serious than driving drunk or child neglect, but it does still impact other people. Library staff, the cost to the library system as a whole, as well as other patrons. So if you're using the library with no regard to how your actions impact others, you are being self-absorbed and irresponsible, and there simply shouldn't be a income requirement that excuses that kind of behavior.

My point is not that I'm so wonderful and everyone else is so terrible. My point is that while yes, I can afford the fines, I have plenty of excuses as to why I might be late returning a library book...and none of those excuses matter. I checked it out, I bring it back, or there are consequences.

I simply don't believe that people who make less money should be less reponsible than those who make more. Moreover, I don't think it helps anyone to be absolved of their responsiblities in society. Everyone who is mentally capable of taking responsibility for their actions should be responsible. If you are capable of going to the library and checking out materials, then you are equally capable of turning them back in on time.",yes,akcrabber,23,2,yes
25,ThePessimist,6/27/19,2:03 PM,"Yeah, that wasn't a cogent argument. I'm unconvinced and still voting ""No"".",yes,akcrabber,23,1,yes
26,doninseattle,6/26/19,8:22 AM,"A list of some of the programs currently offered that have nothing to do with library operations and provision of materials, which completely waste our tax dollars:

Banned Books in Drag Some of Seattle’s best drag artists and comedians give performances inspired by their favorite banned books.

Bird Week We celebrated Seattle Bird Week April 23-30. In partnership with the Seward Park Audubon Center and other local organizations, we hosted nature writing classes, bird sketching and more.

Booktoberfest Each fall, our librarians visit your favorite bars and pubs for Booktoberfest, our celebration of books, beer and good cheer. (such a great expense of time and money!!!!)

Know Your Rights We can help you understand your legal rights as an immigrant or refugee. (shouldn't this be done at city hall?)

Library Link Library Link is a pilot collaboration between The Seattle Public Library and Seattle Public Schools to connect middle school student with online resources and media. (this should be in the middle school  libraries, not duplicated)

Library Lounge Raise a glass to literature in the Library Lounge, a moveable feast of events and celebrations all around Seattle that combine literature and libations.

Make and Build Come to your Library and learn how to program robots, create a mobile app, make crafts with electrical circuits and other fun projects. (again, something that should be done at schools)

Movies We screen free movies at many of our neighborhood branches and we also occasionally host curated film festivals covering a wide spectrum of topics and interests Icon

Museum Pass Your Library helps you get free admission to participating Seattle museums.

This list goes on and on. If the library system was accountable to a realistic budget and operating plan, we would not be placed in such a GIVE ME GIVE ME GIVE ME situation. We need to fund libraries, but not when they become duplicitous to such waste! Add in the fine elimination, this just becomes ridiculous. 

VOTE NO!!!",no,na,na,9,no
27,akcrabber,6/26/19,10:57 AM,"You hate disseminating knowledge, don't you?",yes,doninseattle,26,1,no
28,unkanny,6/26/19,12:23 PM,"Thank you, now I know I'll vote YES.",yes,doninseattle,26,1,no
29,Loodlernoodler,6/26/19,7:59 AM,Voting no.,no,na,na,9,yes
30,Piscator,6/26/19,7:51 AM,"Library fines amount to something like $4.5m per year. In the big scheme of things, collecting the fines will NOT be enough to support the mission of the libraries or keep the buildings adequately maintained.  Perhaps there is another way to encourage personal responsibility for overdue books but maintaining access to all is critically important if we want to raise the next generation into intelligent well rounded adults who can raise the following generation well.

Libraries are a good thing for ALL citizens, let’s make ours the best we can for future generations.",no,na,na,4,no
31,Perry White,6/26/19,7:37 AM,"I'm voting no. The fine suspension is ridiculous. If you can get to the library to borrow a book, you can get there to return it. Government-sponsored avoidance of personal responsibility is detrimental to society. Even small things like a library fine add up to big things. I hope this latest ""social justice"" overreach will fail and sent a message to the SCC and Mayor's office: May we please have some common sense?",no,na,na,14,no
32,oldwsguy,6/26/19,7:34 AM,"I'm voting against this levy, and if it passes--as I'm sure it will--I will make one last donation to the library foundation, then say goodbye.  So sad the library has joined the no personal responsibility camp.",no,na,na,13,no
33,Bellevue Bob,6/26/19,6:48 AM,"""When fines are suspended, libraries see an increase in people checking out materials""

Wow. And I'll bet that if I eliminate fines for speeding, I'll see more people exceeding the speed limit. ",no,na,na,18,no
34,akcrabber,6/26/19,10:59 AM,"Email and text reminders are more effective than fines, but don't let facts influence your curmudgeonly vote.",yes,Bellevue Bob,33,1,no
35,knowledgeisking,6/26/19,11:38 AM,Enough of your mindless responses.,yes,akcrabber,34,7,no
36,ThePessimist,6/27/19,2:06 PM,"If that were the case the SPL could simply implement email and text reminders before fines are imposed and the problem would self-resolve, no?",yes,akcrabber,34,1,no
37,Ikaika,6/26/19,6:41 AM,"Off course they do, you should run the other way.",no,na,na,3,no
38,centrist,6/26/19,6:11 AM,"No consequences for not those not returning shopping carts, rental bikes, or used syringes.  

There are consequences, but they only affect retirees and workers who pay taxes.  

STEB is advocating for even less personal accountability.",no,na,na,15,yes
39,Irving Washington,6/26/19,5:54 AM,I LOVE the Seattle Public Library but now that they're doing the social justice warrior thing I have to vote no. Sorry.  ,no,na,na,21,no
40,akcrabber,6/26/19,11:01 AM,"Did you mean ""I hate seeing poor people having nice things?""",yes,Irving Washington,39,0,no
41,ThePessimist,6/27/19,2:06 PM,"No, that would be a reading comprehension failure on your part. Still voting ""No"".",yes,akcrabber,40,2,no
42,west seattle dude,6/26/19,5:48 AM,"The times makes a strong case for the levy. 
But keep the fines. Dropping them will make everyone, my family included, more lax about due dates, which will erode service to us all.",no,na,na,7,no
43,akcrabber,6/26/19,11:02 AM,Having your borrowing priviledge suspended will make you more dilligent.,yes,west seattle dude,42,0,no
44,user15280107,6/26/19,2:04 AM,"Fines don’t encourage patrons to bring back materials and pay them off, and if you can’t, you can’t.

Has the board ever visited a library? There's a slot labeled ""Return"". Just shove the books in there if you want to return them and duck the fines. And fair enough if they can't checkout more books if they don't pay the fines. That isn't social injustice, it's just irresponsibility.",no,na,na,12,no
45,2th,6/25/19,11:38 PM,"Wow, yet another call to lower standards from the completely clueless editors of the Seattle Times, in spite of all the evidence that shows what damage such an approach does.

It’s like watching someone repeatedly try to put a square peg into a round hole.",no,na,na,3,no
