1,Username,Date,Time,Comment,Reply,Reply-To,Reply-To_Row_Num,Respect_Count,Edited
46,Crystal Gayle,6/25/19,11:06 PM,"Is this the Stranger?  Has Daniel Beekman taken over?  Econ101 Communist version, reporting from Evergreen State College?

This levy (no library late fees, ever) will do for Seattle Public Libraries what the City Council did for homelessness.  

Want to check out this movie?  Sorry, I got it.  And I ain’t brining it back.  Ever.  Leaving it in my car.  Just cuz I can.

The STEB continues to be out of touch with reality... in their race to be hip, like the Stranger?  Where are the adults in the room?",no,na,na,18,no
47,blueskies2,6/26/19,12:33 AM,Beekman needs to go to The Stranger,yes,Crystal Gayle,46,4,no
48,user1044491,6/25/19,10:21 PM,Nope. ,no,na,na,5,no
49,blueskies2,6/25/19,9:27 PM,People need free things.   People do not need responsibility.   Responsibility is not a social justice value.   ,no,na,na,13,no
50,Lookitsme,6/25/19,9:23 PM,"I've never not voted in favor of a library or education levy. 

They lost me this time...too big, and the fines thing is just ludicrous...

I grew up relatively poor... somehow I managed to be responsible enough to return my books on time…",no,na,na,18,no
51,centrist,6/25/19,7:25 PM,"    Fines may seem insignificant to some, but for those on a limited or fixed income, who might lose a book or forget to return it on time

Avoid the fine by returning the items that retiree and worker taxes paid for.

STEB; what other fines do you advocate people not pay?   Fines for speeding, shoplifting, littering, late property tax payment?",no,na,na,13,no
52,user14566891495052,6/25/19,7:28 PM,"Enforce the overdue fines! That's lost income the library could generate. I'm surprised that the Library stopped enforcing overdue fees. That's why they were set in place for. To pay the Library for disappointing patrons who want to read a book that they can only get from them. 

Overdue fees should be used as a life lesson too... Don't way to pay fees? Next time be responsible and remember to bring back something you borrowed. 

That's what I did when I was younger. I remember being a couple days late on a VHS rental and being disappointed in myself for returning it late because I would have to pay for it. Guess what... I paid the fee and vowed to never be late EVER again!

LESSON LEARNED.",no,na,na,5,no
53,user1000576,6/25/19,7:13 PM,I'm voting no! Increase taxes at every opportunity..stop the Seattle way.,no ,na,na,3,no
54,Raindodger,6/25/19,6:26 PM,"Um, no. ",no,na,na,10,no
55,ReadingOne,6/25/19,6:06 PM,"Sorry, I just can't vote for another doubled levy.",no,na,na,17,no
56,knowledgeisking,6/25/19,5:29 PM,The ST is plugging the unpaid fines as one of their social justice warrior initiatives. How about we teach responsibility?,no,na,na,26,no
57,ksea1,6/25/19,5:07 PM,"""At $219 million, it’s almost $100 million more than the $123 million 2012 levy.""

NO!",no,na,na,20,no
58,thedonB,6/25/19,4:09 PM,"Yes, why not (sarcasm)?  Another self imposed tax for the Citizens.

Blame Sound Transit for my ""no"" vote.  As long as they illegally and immorally charge me too much for my car tabs, I will vote ""NO"" on all voluntary taxes.  No fire department, no police, no 911, no parks and no libraries.",no,na,na,12,no